term,definition,source,url_source
PAT,Prime d'aménagement du territoire,Sénat,https://www.senat.fr/histoire/sigles.html
PATRACDVR," Personnels, Armement, Tenue, Radio, Alimentation, Camouflage, Divers, Véhicules, Rassemblement",Denis Merigoux,https://gist.github.com/ColinMaudry/fe30f024d3cea20d1f6ccd579d9acd3f#file-gendarmerie-csv
PAVI,Point d’Appui à la Vie Associative,L. Bohu - maraudes.fr,http://maraudes.fr/glossaire-sigles-social-de-sante-de-ladministration/
PAZ,Plan d'aménagement de zone.,M. Lafay - CCE-LR,http://www.cce-lrv.com/documents/images/general_photos/151_Fichier.pdf
PC,Permis de construire.,M. Lafay - CCE-LR,http://www.cce-lrv.com/documents/images/general_photos/151_Fichier.pdf
PC,Prêt Conventionné,L. Bohu - maraudes.fr,http://maraudes.fr/glossaire-sigles-social-de-sante-de-ladministration/
PCA,Plan Construction et Architecture,L. Bohu - maraudes.fr,http://maraudes.fr/glossaire-sigles-social-de-sante-de-ladministration/
PCE,Prêt à la création d'entreprise,Sénat,https://www.senat.fr/histoire/sigles.html
PCE,Projet environnemental commun.,M. Lafay - CCE-LR,http://www.cce-lrv.com/documents/images/general_photos/151_Fichier.pdf
PCH,Prestation de compensation du handicap,Sénat,https://www.senat.fr/histoire/sigles.html
PCI,Plan Cadastral Informatisé,beta.gouv.fr,https://github.com/betagouv/glossary-bot
PCL,Prêt Conventionné Locatif,L. Bohu - maraudes.fr,http://maraudes.fr/glossaire-sigles-social-de-sante-de-ladministration/
PCMR,Pensions civile et militaire de retraite,DGAFP,https://www.fonction-publique.gouv.fr/files/files/statistiques/rapports_annuels/2016/G_Liste_des_sigles.pdf
PCN,Procédure Concurrentielle avec Négociation,marche-public.fr,http://www.marche-public.fr/Marches-publics/Definitions/Marches-publics-Sigles.htm
PCO,Poste de Commandement Opérationnel,Denis Merigoux,https://gist.github.com/ColinMaudry/fe30f024d3cea20d1f6ccd579d9acd3f#file-gendarmerie-csv
PCP,Politique communautaire de la pêche,Sénat,https://www.senat.fr/histoire/sigles.html
PCQP,Petit Carnet Qui Pue,Denis Merigoux,https://gist.github.com/ColinMaudry/fe30f024d3cea20d1f6ccd579d9acd3f#file-gendarmerie-csv
PCRP,Personne chargée de la radio protection,DGOS,http://www.metiers-fonctionpubliquehospitaliere.sante.gouv.fr/Lexique-des-abreviations-ou-sigles.html
PCRS,"Plan Corps de Rue Simplifié. Plan 2D/3D très grande échelle de la voirie et de l’espace public. Modélise trottoirs et leur hauteur, accès réseaux enterrés, pistes, mobilier urbain et bâtiments.",beta.gouv.fr,https://github.com/betagouv/glossary-bot
PCS,Plan de cohésion sociale.,M. Lafay - CCE-LR,http://www.cce-lrv.com/documents/images/general_photos/151_Fichier.pdf
PCS,Profession et catégorie socioprofessionnelle,DGAFP,https://www.fonction-publique.gouv.fr/files/files/statistiques/rapports_annuels/2016/G_Liste_des_sigles.pdf
PDAHI,Plans Départementaux d’Accueil d’Hébergement et d’Insertion (voir aussi SIAO),L. Bohu - maraudes.fr,http://maraudes.fr/glossaire-sigles-social-de-sante-de-ladministration/
PDALPD,Plan départemental d'action pour le logement des personnes défavorisées,Sénat,https://www.senat.fr/histoire/sigles.html
PDC,Procédure de Dialogue Compétitif,marche-public.fr,http://www.marche-public.fr/Marches-publics/Definitions/Marches-publics-Sigles.htm
PDD,Plan de déplacement durable.,M. Lafay - CCE-LR,http://www.cce-lrv.com/documents/images/general_photos/151_Fichier.pdf
PDEMA,Plan départemental d'élimination des déchets ménagers et assimilés,M. Lafay - CCE-LR,http://www.cce-lrv.com/documents/images/general_photos/151_Fichier.pdf
PDF,Portable document format.,M. Lafay - CCE-LR,http://www.cce-lrv.com/documents/images/general_photos/151_Fichier.pdf
PDH,Plan départemental de l'habitat,Sénat,https://www.senat.fr/histoire/sigles.html
PDI,Programme départemental d’insertion,L. Bohu - maraudes.fr,http://maraudes.fr/glossaire-sigles-social-de-sante-de-ladministration/
PDI,Plan départemental de l’insertion,L. Bohu - maraudes.fr,http://maraudes.fr/glossaire-sigles-social-de-sante-de-ladministration/
PDITH,Programme Ddépartemental d’Insertion des Travailleurs Handicapés,L. Bohu - maraudes.fr,http://maraudes.fr/glossaire-sigles-social-de-sante-de-ladministration/
PDL,Plan départemental du Logement,L. Bohu - maraudes.fr,http://maraudes.fr/glossaire-sigles-social-de-sante-de-ladministration/
PDR,Programme de développement rural.,M. Lafay - CCE-LR,http://www.cce-lrv.com/documents/images/general_photos/151_Fichier.pdf
PDS,Permanence Des Soins,L. Bohu - maraudes.fr,http://maraudes.fr/glossaire-sigles-social-de-sante-de-ladministration/
PDU,Plan de développement urbain,Sénat,https://www.senat.fr/histoire/sigles.html
PDU,Plan de Déplacements Urbains,Code des transports,https://www.legifrance.gouv.fr/affichCodeArticle.do?idArticle=LEGIARTI000031104573&cidTexte=LEGITEXT000023086525&dateTexte=20150809
PDZ,Plan de déplacement de zone.,M. Lafay - CCE-LR,http://www.cce-lrv.com/documents/images/general_photos/151_Fichier.pdf
PDZR,Programme de déplacement des zones rurales.,M. Lafay - CCE-LR,http://www.cce-lrv.com/documents/images/general_photos/151_Fichier.pdf
PE,Parlement européen.,M. Lafay - CCE-LR,http://www.cce-lrv.com/documents/images/general_photos/151_Fichier.pdf
PE,Pôle emploi,beta.gouv.fr,https://github.com/betagouv/glossary-bot
PE,Projet d’Etablissement,L. Bohu - maraudes.fr,http://maraudes.fr/glossaire-sigles-social-de-sante-de-ladministration/
PEA,Plans d’épargne en actions,Sénat,https://www.senat.fr/histoire/sigles.html
PEB,Plan d'exposition au bruit.,M. Lafay - CCE-LR,http://www.cce-lrv.com/documents/images/general_photos/151_Fichier.pdf
PEC,Prise En Charge,L. Bohu - maraudes.fr,http://maraudes.fr/glossaire-sigles-social-de-sante-de-ladministration/
PED,Plan local de déplacement,M. Lafay - CCE-LR,http://www.cce-lrv.com/documents/images/general_photos/151_Fichier.pdf
PEDA," Perception, Évaluation, Décision, Action",Denis Merigoux,https://gist.github.com/ColinMaudry/fe30f024d3cea20d1f6ccd579d9acd3f#file-gendarmerie-csv
PEE,Plan d'épargne d'entreprise,Sénat,https://www.senat.fr/histoire/sigles.html
PEEC,Participation des employeurs à l'effort de construction,Sénat,https://www.senat.fr/histoire/sigles.html
PEGC,Professeur d'enseignement général de collège,Sénat,https://www.senat.fr/histoire/sigles.html
PEI,Projet Éducatif Individualisé,L. Bohu - maraudes.fr,http://maraudes.fr/glossaire-sigles-social-de-sante-de-ladministration/
PEL,Plans d’épargne logement,Sénat,https://www.senat.fr/histoire/sigles.html
PELG,Pilote d'Embarcation Légère de la Gendarmerie,Denis Merigoux,https://gist.github.com/ColinMaudry/fe30f024d3cea20d1f6ccd579d9acd3f#file-gendarmerie-csv
PEO,Procédure évaluation orientation,L. Bohu - maraudes.fr,http://maraudes.fr/glossaire-sigles-social-de-sante-de-ladministration/
PEP,Plans d'épargne populaire,Sénat,https://www.senat.fr/histoire/sigles.html
PEP,Pupilles de l’Enseignement Public,L. Bohu - maraudes.fr,http://maraudes.fr/glossaire-sigles-social-de-sante-de-ladministration/
PEPITE,"Pôles Etudiants Pour l'Innovation, le Transfert et l'Entrepreneuriat",beta.gouv.fr,https://github.com/betagouv/glossary-bot
PEPS,professeurs d’éducation physique et sportive,L. Bohu - maraudes.fr,http://maraudes.fr/glossaire-sigles-social-de-sante-de-ladministration/
PER,Plans d'exposition aux risques.,Sénat,https://www.senat.fr/histoire/sigles.html
PER,Plan d’épargne retraite,Sénat,https://www.senat.fr/histoire/sigles.html
PERCO,Plan d'épargne pour la retraite collectif,Sénat,https://www.senat.fr/histoire/sigles.html
PERNP,Plan d'exposition aux risques naturels prévisibles.,M. Lafay - CCE-LR,http://www.cce-lrv.com/documents/images/general_photos/151_Fichier.pdf
PERP,Plan d'épargne retraite populaire,Sénat,https://www.senat.fr/histoire/sigles.html
PES,Point d'Entrée-Sortie,Denis Merigoux,https://gist.github.com/ColinMaudry/fe30f024d3cea20d1f6ccd579d9acd3f#file-gendarmerie-csv
PESD,Politique européenne de sécurité et de défense,Sénat,https://www.senat.fr/histoire/sigles.html
PETR,Pôle d'équilibre territorial et rural,Préfet de la région Bretagne,http://www.bretagne.developpement-durable.gouv.fr/les-poles-d-equilibre-territorial-et-rural-petr-a3591.html
PEU,Point d'Entrée Unique,Denis Merigoux,https://gist.github.com/ColinMaudry/fe30f024d3cea20d1f6ccd579d9acd3f#file-gendarmerie-csv
PF,Protection Fonctionnelle,Denis Merigoux,https://gist.github.com/ColinMaudry/fe30f024d3cea20d1f6ccd579d9acd3f#file-gendarmerie-csv
PFD,Programme Fonctionnel Détaillé,marche-public.fr,http://www.marche-public.fr/Marches-publics/Definitions/Marches-publics-Sigles.htm
PFE,Projet De Fin D’étude,L. Bohu - maraudes.fr,http://maraudes.fr/glossaire-sigles-social-de-sante-de-ladministration/
PFR,Prime de Fonctions et de Résultats,Publidia,https://concours-fonction-publique.publidia.fr/guide-fonction-publique/infos-utiles/lexique-fonction-publique
PFS,Placement familial spécialisé,L. Bohu - maraudes.fr,http://maraudes.fr/glossaire-sigles-social-de-sante-de-ladministration/
PGD,Prestation de Garde à Domicile.,L. Bohu - maraudes.fr,http://maraudes.fr/glossaire-sigles-social-de-sante-de-ladministration/
PGHM,Peloton de Gendarmerie de Haute Montagne,Denis Merigoux,https://gist.github.com/ColinMaudry/fe30f024d3cea20d1f6ccd579d9acd3f#file-gendarmerie-csv
PGI,Progiciel de Gestion Intégré,DGOS,http://www.metiers-fonctionpubliquehospitaliere.sante.gouv.fr/Lexique-des-abreviations-ou-sigles.html
PGM,Peloton de Gendarmerie en Montagne,Denis Merigoux,https://gist.github.com/ColinMaudry/fe30f024d3cea20d1f6ccd579d9acd3f#file-gendarmerie-csv
PGO,Partenariat pour un Gouvernement Ouvert (OGP en anglais),beta.gouv.fr,https://github.com/betagouv/glossary-bot
PGS,Plan de gêne sonore.,M. Lafay - CCE-LR,http://www.cce-lrv.com/documents/images/general_photos/151_Fichier.pdf
PH,Praticien Hospitalier,L. Bohu - maraudes.fr,http://maraudes.fr/glossaire-sigles-social-de-sante-de-ladministration/
PHEC,Plus hautes eaux connues.,M. Lafay - CCE-LR,http://www.cce-lrv.com/documents/images/general_photos/151_Fichier.pdf
PHISP,Pharmacien inspecteur de la Santé Publique,L. Bohu - maraudes.fr,http://maraudes.fr/glossaire-sigles-social-de-sante-de-ladministration/
PHP,Hypertext Preprocessor,beta.gouv.fr,https://github.com/betagouv/glossary-bot
PHR,Peloton Hors Rang,Denis Merigoux,https://gist.github.com/ColinMaudry/fe30f024d3cea20d1f6ccd579d9acd3f#file-gendarmerie-csv
PHRC,Programme hospitalier de recherche clinique,Keratocone,https://www.keratocone.net/acronymes.html
PI,Prestations Intellectuelles,marche-public.fr,http://www.marche-public.fr/Marches-publics/Definitions/Marches-publics-Sigles.htm
PI,Profession intermédiaire,DGAFP,https://www.fonction-publique.gouv.fr/files/files/statistiques/rapports_annuels/2016/G_Liste_des_sigles.pdf
PI,Projet Individualisé,L. Bohu - maraudes.fr,http://maraudes.fr/glossaire-sigles-social-de-sante-de-ladministration/
PI,Peloton d'Intervention,Denis Merigoux,https://gist.github.com/ColinMaudry/fe30f024d3cea20d1f6ccd579d9acd3f#file-gendarmerie-csv
PI2G,Peloton d'Intervention de 2e Génération,Denis Merigoux,https://gist.github.com/ColinMaudry/fe30f024d3cea20d1f6ccd579d9acd3f#file-gendarmerie-csv
PIA,Programme d'Investissements d'Avenir,beta.gouv.fr,https://github.com/betagouv/glossary-bot
PIAC,Plate-forme d'Identification des Avoirs Criminels,Denis Merigoux,https://gist.github.com/ColinMaudry/fe30f024d3cea20d1f6ccd579d9acd3f#file-gendarmerie-csv
PIAHPA,Programmes Interdépartementaux d’Accompagnement des Handicaps et la Perte d’Autonomie,L. Bohu - maraudes.fr,http://maraudes.fr/glossaire-sigles-social-de-sante-de-ladministration/
PIB,Production intérieure brute ou produit intérieur brut,Sénat,https://www.senat.fr/histoire/sigles.html
PIC,Programme d’initiative communautaire,L. Bohu - maraudes.fr,http://maraudes.fr/glossaire-sigles-social-de-sante-de-ladministration/
PICS,Programme ingénieurs et cadres supérieurs,L. Bohu - maraudes.fr,http://maraudes.fr/glossaire-sigles-social-de-sante-de-ladministration/
PIDA,Plan d'intervention pour le déclenchement des avalanches,M. Lafay - CCE-LR,http://www.cce-lrv.com/documents/images/general_photos/151_Fichier.pdf
PIE,Pistolet à Impulsions Électriques,Denis Merigoux,https://gist.github.com/ColinMaudry/fe30f024d3cea20d1f6ccd579d9acd3f#file-gendarmerie-csv
PIF,Points Info Famille,L. Bohu - maraudes.fr,http://maraudes.fr/glossaire-sigles-social-de-sante-de-ladministration/
PIF,Presidential Innovation Fellows,beta.gouv.fr,https://github.com/betagouv/glossary-bot
PIF,Programme Individualisé de Formation,L. Bohu - maraudes.fr,http://maraudes.fr/glossaire-sigles-social-de-sante-de-ladministration/
PIG,Projets d'intérêt général,Sénat,https://www.senat.fr/histoire/sigles.html
PII,Plan d'intervention interne.,M. Lafay - CCE-LR,http://www.cce-lrv.com/documents/images/general_photos/151_Fichier.pdf
PIIS,projet individuel d’intégration scolaire,L. Bohu - maraudes.fr,http://maraudes.fr/glossaire-sigles-social-de-sante-de-ladministration/
PIJ,Points d’information jeunesse,beta.gouv.fr,https://github.com/betagouv/glossary-bot
PIL,Programme d'insertion locale,Sénat,https://www.senat.fr/histoire/sigles.html
PIM,Programmes intégrés méditerranéens,Sénat,https://www.senat.fr/histoire/sigles.html
PIN,Programme d’initiative nationale>,L. Bohu - maraudes.fr,http://maraudes.fr/glossaire-sigles-social-de-sante-de-ladministration/
PISA,Programme international de suivi des acquis,Sénat,https://www.senat.fr/histoire/sigles.html
PJ,Police Judiciaire,Denis Merigoux,https://gist.github.com/ColinMaudry/fe30f024d3cea20d1f6ccd579d9acd3f#file-gendarmerie-csv
PJGN,Pôle Judiciaire de la Gendarmerie Nationale,Denis Merigoux,https://gist.github.com/ColinMaudry/fe30f024d3cea20d1f6ccd579d9acd3f#file-gendarmerie-csv
PJJ,Protection judiciaire de la jeunesse,Sénat,https://www.senat.fr/histoire/sigles.html
PL,Poids Lourd,Denis Merigoux,https://gist.github.com/ColinMaudry/fe30f024d3cea20d1f6ccd579d9acd3f#file-gendarmerie-csv
PLA,Prêt locatif aidé,Sénat,https://www.senat.fr/histoire/sigles.html
PLACE,Plateforme des achats de l'État,marche-public.fr,http://www.marche-public.fr/Marches-publics/Definitions/Marches-publics-Sigles.htm
PLAI,Prêt locatif aidé d'intégration,Sénat,https://www.senat.fr/histoire/sigles.html
PLAJ,Projets locaux d'animation jeunesse,Sénat,https://www.senat.fr/histoire/sigles.html
PLAN ORSEC,Plan d'organisation des secours,M. Lafay - CCE-LR,http://www.cce-lrv.com/documents/images/general_photos/151_Fichier.pdf
PLAS,Projets locaux d'animation sportive,Sénat,https://www.senat.fr/histoire/sigles.html
PLATS,Prêt Locatif Aidé Très Social,L. Bohu - maraudes.fr,http://maraudes.fr/glossaire-sigles-social-de-sante-de-ladministration/
PLD,Plafond légal de densité,Sénat,https://www.senat.fr/histoire/sigles.html
PLDS,Plan local de développement social,L. Bohu - maraudes.fr,http://maraudes.fr/glossaire-sigles-social-de-sante-de-ladministration/
PLE,Programmes locaux pour l’enfance,L. Bohu - maraudes.fr,http://maraudes.fr/glossaire-sigles-social-de-sante-de-ladministration/
PLF,Projet de loi de finances,Ministère de la Justice,http://www.justice.gouv.fr/art_pix/Stat_Annuaire_ministere-justice_sigles.pdf
PLFSS,Projet de loi de financement de la Sécurité sociale,Keratocone,https://www.keratocone.net/acronymes.html
PLH,Programme local de l'habitat,Sénat,https://www.senat.fr/histoire/sigles.html
PLI,Plan local d’insertion,L. Bohu - maraudes.fr,http://maraudes.fr/glossaire-sigles-social-de-sante-de-ladministration/
PLI,Prêt locatif intermédiaire,Sénat,https://www.senat.fr/histoire/sigles.html
PLI,Programme local d'installation.,M. Lafay - CCE-LR,http://www.cce-lrv.com/documents/images/general_photos/151_Fichier.pdf
PLIE,Plan local d’insertion par l’économique,L. Bohu - maraudes.fr,http://maraudes.fr/glossaire-sigles-social-de-sante-de-ladministration/
PLIF,Programme local d’insertion des femmes isolées,L. Bohu - maraudes.fr,http://maraudes.fr/glossaire-sigles-social-de-sante-de-ladministration/
PLIR,Plan de Lutte contre l'Insécurité Routière,Denis Merigoux,https://gist.github.com/ColinMaudry/fe30f024d3cea20d1f6ccd579d9acd3f#file-gendarmerie-csv
PLOUF,Projet de loi d'orientation urbaine et foncière.,M. Lafay - CCE-LR,http://www.cce-lrv.com/documents/images/general_photos/151_Fichier.pdf
PLR,Programmes de logements à loyer réduit,Sénat,https://www.senat.fr/histoire/sigles.html
PLS,Prêt locatif social,Sénat,https://www.senat.fr/histoire/sigles.html
PLU,Plan local d'urbanisme,Sénat,https://www.senat.fr/histoire/sigles.html
PLUS,Prêt locatif à usage social,Sénat,https://www.senat.fr/histoire/sigles.html
PM,Premier Ministre,beta.gouv.fr,https://github.com/betagouv/glossary-bot
PM,Projet Médical,L. Bohu - maraudes.fr,http://maraudes.fr/glossaire-sigles-social-de-sante-de-ladministration/
PM,Police Municipale ou Pistolet-Mitrailleur,Denis Merigoux,https://gist.github.com/ColinMaudry/fe30f024d3cea20d1f6ccd579d9acd3f#file-gendarmerie-csv
PM(S)G,Préparation Militaire (Supérieure) Gendarmerie,Denis Merigoux,https://gist.github.com/ColinMaudry/fe30f024d3cea20d1f6ccd579d9acd3f#file-gendarmerie-csv
PMA,Pays moins avancés,Sénat,https://www.senat.fr/histoire/sigles.html
PMD,Psychose Maniaco-Dépresive,L. Bohu - maraudes.fr,http://maraudes.fr/glossaire-sigles-social-de-sante-de-ladministration/
PME,Petites et moyennes entreprises,Sénat,https://www.senat.fr/histoire/sigles.html
PMF,Personnel Militaire Féminin,Denis Merigoux,https://gist.github.com/ColinMaudry/fe30f024d3cea20d1f6ccd579d9acd3f#file-gendarmerie-csv
PMI,Petites et moyennes industries.,Sénat,https://www.senat.fr/histoire/sigles.html
PMI,Protection maternelle et infantile,Sénat,https://www.senat.fr/histoire/sigles.html
PMIPDN,Périodes Militaires d'Initiation ou de Perfectionnement à la Défense Nationale,Denis Merigoux,https://gist.github.com/ColinMaudry/fe30f024d3cea20d1f6ccd579d9acd3f#file-gendarmerie-csv
PMO,Prélèvement multi-organes,DGOS,http://www.metiers-fonctionpubliquehospitaliere.sante.gouv.fr/Lexique-des-abreviations-ou-sigles.html
PMO,Peloton MOtorisé,Denis Merigoux,https://gist.github.com/ColinMaudry/fe30f024d3cea20d1f6ccd579d9acd3f#file-gendarmerie-csv
PMPOA,Programme de maîtrise des pollutions d'origine agricole,Sénat,https://www.senat.fr/histoire/sigles.html
PMS,Préparation militaire supérieure,Sénat,https://www.senat.fr/histoire/sigles.html
PMSI,Programme de médicalisation des systèmes d'information,Sénat,https://www.senat.fr/histoire/sigles.html
PMT,Projet Médical de Territoire,L. Bohu - maraudes.fr,http://maraudes.fr/glossaire-sigles-social-de-sante-de-ladministration/
PMU,Pari mutuel urbain,Sénat,https://www.senat.fr/histoire/sigles.html
PMV,Panneau à Message Variable,Denis Merigoux,https://gist.github.com/ColinMaudry/fe30f024d3cea20d1f6ccd579d9acd3f#file-gendarmerie-csv
PN,Parc National.,M. Lafay - CCE-LR,http://www.cce-lrv.com/documents/images/general_photos/151_Fichier.pdf
PN,Police Nationale,Denis Merigoux,https://gist.github.com/ColinMaudry/fe30f024d3cea20d1f6ccd579d9acd3f#file-gendarmerie-csv
PNAAPD,Plan National d’Action pour des Achats Publics Durables,marche-public.fr,http://www.marche-public.fr/Marches-publics/Definitions/Marches-publics-Sigles.htm
PNAEE,Programme national d'aménagement de l'efficacité énergétique.,M. Lafay - CCE-LR,http://www.cce-lrv.com/documents/images/general_photos/151_Fichier.pdf
PNAQ,Plan national d'allocations de quotas,Sénat,https://www.senat.fr/histoire/sigles.html
PNB,Produit national brut,Sénat,https://www.senat.fr/histoire/sigles.html
PNDS,Portail National des Droits sociaux,beta.gouv.fr,https://github.com/betagouv/glossary-bot
PNDS,Protocole national de diagnostic et de soins,Keratocone,https://www.keratocone.net/acronymes.html
PNE,Plateforme Numérique de l’état,beta.gouv.fr,https://github.com/betagouv/glossary-bot
PNL,Programmation Neuro-Linguistique,L. Bohu - maraudes.fr,http://maraudes.fr/glossaire-sigles-social-de-sante-de-ladministration/
PNMR,Plan national maladies rares,Keratocone,https://www.keratocone.net/acronymes.html
PNN,Produit national net.,M. Lafay - CCE-LR,http://www.cce-lrv.com/documents/images/general_photos/151_Fichier.pdf
PNNS,Plan National Nutrition Santé,DGOS,http://www.metiers-fonctionpubliquehospitaliere.sante.gouv.fr/Lexique-des-abreviations-ou-sigles.html
PNR,Parc naturel régional,M. Lafay - CCE-LR,http://www.cce-lrv.com/documents/images/general_photos/151_Fichier.pdf
PNRU,Programme national de rénovation urbaine,Sénat,https://www.senat.fr/histoire/sigles.html
PNU,Programme national d'intégration urbaine.,M. Lafay - CCE-LR,http://www.cce-lrv.com/documents/images/general_photos/151_Fichier.pdf
PNUD,Programme des Nations unies pour le développement,Sénat,https://www.senat.fr/histoire/sigles.html
PNUE,Programme des Nations unies pour l'environnement,Sénat,https://www.senat.fr/histoire/sigles.html
PNVASA," Position, Nature, Volume, Attitude, Substances psychoactives absorbées, Armement",Denis Merigoux,https://gist.github.com/ColinMaudry/fe30f024d3cea20d1f6ccd579d9acd3f#file-gendarmerie-csv
PO,Product Owner,beta.gouv.fr,https://github.com/betagouv/glossary-bot
PO,Programme opérationnel,L. Bohu - maraudes.fr,http://maraudes.fr/glossaire-sigles-social-de-sante-de-ladministration/
POA,Prime d'orientation agricole,Sénat,https://www.senat.fr/histoire/sigles.html
POI,Plan d'occupation interne.,M. Lafay - CCE-LR,http://www.cce-lrv.com/documents/images/general_photos/151_Fichier.pdf
POI,Plan d'Opération Interne,Denis Merigoux,https://gist.github.com/ColinMaudry/fe30f024d3cea20d1f6ccd579d9acd3f#file-gendarmerie-csv
POLMAR,Plan ORSEC pollution marine,Sénat,https://www.senat.fr/histoire/sigles.html
POPS,Protocole d’Occupation du Patrimoine Social,L. Bohu - maraudes.fr,http://maraudes.fr/glossaire-sigles-social-de-sante-de-ladministration/
POS,Plan d'occupation des sols,Sénat,https://www.senat.fr/histoire/sigles.html
POS,Procédure Opératoire Standard,DGOS,http://www.metiers-fonctionpubliquehospitaliere.sante.gouv.fr/Lexique-des-abreviations-ou-sigles.html
POSEIDOM,Programme d'options spécifiques à l'éloignement et l'insularité des départements d'outre-mer,Sénat,https://www.senat.fr/histoire/sigles.html
PPA,Plan de protection de l'atmosphère,M. Lafay - CCE-LR,http://www.cce-lrv.com/documents/images/general_photos/151_Fichier.pdf
PPA,Personne publique associée,M. Lafay - CCE-LR,http://www.cce-lrv.com/documents/images/general_photos/151_Fichier.pdf
PPAE,Projet personnalisé d'accès à l'emploi,Sénat,https://www.senat.fr/histoire/sigles.html
PPC,Projet Personnalisé de Compensation,L. Bohu - maraudes.fr,http://maraudes.fr/glossaire-sigles-social-de-sante-de-ladministration/
PPE,Programmes prioritaires d'exécution,Sénat,https://www.senat.fr/histoire/sigles.html
PPE,Programmes prioritaires d'équipement,Sénat,https://www.senat.fr/histoire/sigles.html
PPESV,Plan partenarial d'épargne salariale volontaire,Sénat,https://www.senat.fr/histoire/sigles.html
PPESVR,Plan partenarial d'épargne salariale volontaire pour la retraite,Sénat,https://www.senat.fr/histoire/sigles.html
PPH,Préparateur En Pharmacie Hospitalière,L. Bohu - maraudes.fr,http://maraudes.fr/glossaire-sigles-social-de-sante-de-ladministration/
PPI,Plan particulier d'intervention,Sénat,https://www.senat.fr/histoire/sigles.html
PPI,Plan pluriannuel d’investissements,DGOS,http://www.metiers-fonctionpubliquehospitaliere.sante.gouv.fr/Lexique-des-abreviations-ou-sigles.html
PPI,Provision des investissements,Sénat,https://www.senat.fr/histoire/sigles.html
PPI,Plan Particulier d'Intervention ou Parties Prenantes Individuelles,Denis Merigoux,https://gist.github.com/ColinMaudry/fe30f024d3cea20d1f6ccd579d9acd3f#file-gendarmerie-csv
PPM,Président du Personnel Militaire,Denis Merigoux,https://gist.github.com/ColinMaudry/fe30f024d3cea20d1f6ccd579d9acd3f#file-gendarmerie-csv
PPMS,Plan particulier de mise en sûreté face aux risques majeurs,M. Lafay - CCE-LR,http://www.cce-lrv.com/documents/images/general_photos/151_Fichier.pdf
PPNG,Plan Préféctures Nouvelle Génération,beta.gouv.fr,https://github.com/betagouv/glossary-bot
PPP,Partenariat public privé,Sénat,https://www.senat.fr/histoire/sigles.html
PPP,Préfecture de Police de Paris,beta.gouv.fr,https://github.com/betagouv/glossary-bot
PPR,Plan de prévention des risques,Sénat,https://www.senat.fr/histoire/sigles.html
PPRE,Programme personnalisé de réussite éducative,Sénat,https://www.senat.fr/histoire/sigles.html
PPRI,Plan de prévention des risques d'inondation.,M. Lafay - CCE-LR,http://www.cce-lrv.com/documents/images/general_photos/151_Fichier.pdf
PPRIF,Plan de prévention des risques incendie de forêt.,M. Lafay - CCE-LR,http://www.cce-lrv.com/documents/images/general_photos/151_Fichier.pdf
PPRN,Plan de prévention des risques naturels,Sénat,https://www.senat.fr/histoire/sigles.html
PPRNP,Plan de prévention des risques naturels prévisibles.,M. Lafay - CCE-LR,http://www.cce-lrv.com/documents/images/general_photos/151_Fichier.pdf
PPRR,Programme de Prévention du Risque Routier,Denis Merigoux,https://gist.github.com/ColinMaudry/fe30f024d3cea20d1f6ccd579d9acd3f#file-gendarmerie-csv
PPRT,Plan de prévention des risques technologiques,Sénat,https://www.senat.fr/histoire/sigles.html
PPS,Prêts participatifs simplifiés,Sénat,https://www.senat.fr/histoire/sigles.html
PPS,Projet Personnalisé De Scolarisation,L. Bohu - maraudes.fr,http://maraudes.fr/glossaire-sigles-social-de-sante-de-ladministration/
PPSPS,Plan Particulier de Sécurité et de Protection de la Santé,marche-public.fr,http://www.marche-public.fr/Marches-publics/Definitions/Marches-publics-Sigles.htm
PPTH,Prospecteur placier pour travailleur handicapé,L. Bohu - maraudes.fr,http://maraudes.fr/glossaire-sigles-social-de-sante-de-ladministration/
