term,definition,source,url_source
ENPJJ,Ecole Nationale de la Protection Judiciaire de la Jeunesse,Publidia,https://concours-fonction-publique.publidia.fr/guide-fonction-publique/infos-utiles/lexique-fonction-publique
ENR,Énergies renouvelables,M. Lafay - CCE-LR,http://www.cce-lrv.com/documents/images/general_photos/151_Fichier.pdf
ENS,École normale supérieure,Sénat,https://www.senat.fr/histoire/sigles.html
ENSA,École nationale de ski et d'alpinisme,DGAFP,https://www.fonction-publique.gouv.fr/files/files/statistiques/rapports_annuels/2016/G_Liste_des_sigles.pdf
ENSAE,École nationale de la statistique et de l'administration économique.,M. Lafay - CCE-LR,http://www.cce-lrv.com/documents/images/general_photos/151_Fichier.pdf
ENSD,Espace naturel sensible des départements,M. Lafay - CCE-LR,http://www.cce-lrv.com/documents/images/general_photos/151_Fichier.pdf
ENSM,Ecole Nationale Supèrieure Maritime,ENSM,https://www.supmaritime.fr/
ENSOP,Ecole Nationale Supérieure des Officiers de Police,Publidia,https://concours-fonction-publique.publidia.fr/guide-fonction-publique/infos-utiles/lexique-fonction-publique
ENSOSP,École nationale des officiers de sapeurs pompiers,DGAFP,https://www.fonction-publique.gouv.fr/files/files/statistiques/rapports_annuels/2016/G_Liste_des_sigles.pdf
ENSP,Ecole Nationale de Santé Publique,DGOS,http://www.metiers-fonctionpubliquehospitaliere.sante.gouv.fr/Lexique-des-abreviations-ou-sigles.html
ENSP,École nationale supérieure de police,DGAFP,https://www.fonction-publique.gouv.fr/files/files/statistiques/rapports_annuels/2016/G_Liste_des_sigles.pdf
ENT,Espace Numérique De Travail,L. Bohu - maraudes.fr,http://maraudes.fr/glossaire-sigles-social-de-sante-de-ladministration/
ENV,École nationale de voile,DGAFP,https://www.fonction-publique.gouv.fr/files/files/statistiques/rapports_annuels/2016/G_Liste_des_sigles.pdf
EOGN,École des Officiers de la Gendarmerie Nationale,Denis Merigoux,https://gist.github.com/ColinMaudry/fe30f024d3cea20d1f6ccd579d9acd3f#file-gendarmerie-csv
EOR,Élève-Officier de la Réserve,Denis Merigoux,https://gist.github.com/ColinMaudry/fe30f024d3cea20d1f6ccd579d9acd3f#file-gendarmerie-csv
EP,Entente Préalable,L. Bohu - maraudes.fr,http://maraudes.fr/glossaire-sigles-social-de-sante-de-ladministration/
EP,Établissement public,M. Lafay - CCE-LR,http://www.cce-lrv.com/documents/images/general_photos/151_Fichier.pdf
EPA,Ecole de plein-air,L. Bohu - maraudes.fr,http://maraudes.fr/glossaire-sigles-social-de-sante-de-ladministration/
EPA,Établissement public à caractère administratif,DGAFP,https://www.fonction-publique.gouv.fr/files/files/statistiques/rapports_annuels/2016/G_Liste_des_sigles.pdf
EPA,Établissements publics à caractère administratif,Sénat,https://www.senat.fr/histoire/sigles.html
EPAD,Établissement public pour l'aménagement de la Défense,Sénat,https://www.senat.fr/histoire/sigles.html
EPARECA,Établissement public d’aménagement et de reconstruction des espaces commerciaux et artisanaux,Sénat,https://www.senat.fr/histoire/sigles.html
EPCA,Etablissement Public à Caractère Administratif,beta.gouv.fr,https://github.com/betagouv/glossary-bot
EPCC,Etablissement public de coopération culturelle,Sénat,https://www.senat.fr/histoire/sigles.html
EPCI,Etablissement public de coopération intercommunale,Sénat,https://www.senat.fr/histoire/sigles.html
EPCSC,Établissement public à caractère scientifique et culturel,M. Lafay - CCE-LR,http://www.cce-lrv.com/documents/images/general_photos/151_Fichier.pdf
EPDSAE,"Établissement Public Départemental de Soins, d’Adaptation et d’Éducation",L. Bohu - maraudes.fr,http://maraudes.fr/glossaire-sigles-social-de-sante-de-ladministration/
EPE,Ecole des parents et éducateurs,L. Bohu - maraudes.fr,http://maraudes.fr/glossaire-sigles-social-de-sante-de-ladministration/
EPF,Enquête Périnatale Française,L. Bohu - maraudes.fr,http://maraudes.fr/glossaire-sigles-social-de-sante-de-ladministration/
EPF,Établissement public foncier (état),M. Lafay - CCE-LR,http://www.cce-lrv.com/documents/images/general_photos/151_Fichier.pdf
EPFIA,European Federation of Pharmaceutical Industries and Associations,Keratocone,https://www.keratocone.net/acronymes.html
EPFL,Etablissement public foncier local,Sénat,https://www.senat.fr/histoire/sigles.html
EPGV,Education Physique et Gymnastique Volontaire,L. Bohu - maraudes.fr,http://maraudes.fr/glossaire-sigles-social-de-sante-de-ladministration/
EPI,Equipement de protection individuelle,DGOS,http://www.metiers-fonctionpubliquehospitaliere.sante.gouv.fr/Lexique-des-abreviations-ou-sigles.html
EPI,Étude prévisionnelle d'installation.,M. Lafay - CCE-LR,http://www.cce-lrv.com/documents/images/general_photos/151_Fichier.pdf
EPIC,Établissements publics industriels et commerciaux,Sénat,https://www.senat.fr/histoire/sigles.html
EPIDe,Etablissement public d'insertion de la Défense,Sénat,https://www.senat.fr/histoire/sigles.html
EPL,Établissement public local.,M. Lafay - CCE-LR,http://www.cce-lrv.com/documents/images/general_photos/151_Fichier.pdf
EPLE,Etablissements publics locaux d'enseignement,Sénat,https://www.senat.fr/histoire/sigles.html
EPM,Etablissements pénitentiaires pour mineurs,L. Bohu - maraudes.fr,http://maraudes.fr/glossaire-sigles-social-de-sante-de-ladministration/
EPMO,Emploi Protégé en Milieu Ordinaire,L. Bohu - maraudes.fr,http://maraudes.fr/glossaire-sigles-social-de-sante-de-ladministration/
EPMOTC,Etablissement public chargé de la maîtrise d’ouvrage de travaux culturels,Sénat,https://www.senat.fr/histoire/sigles.html
EPMS,Établissement Public Médico-social,L. Bohu - maraudes.fr,http://maraudes.fr/glossaire-sigles-social-de-sante-de-ladministration/
EPMS,Éducation Physique Militaire et Sportive,Denis Merigoux,https://gist.github.com/ColinMaudry/fe30f024d3cea20d1f6ccd579d9acd3f#file-gendarmerie-csv
EPN,Établissement public national,DGAFP,https://www.fonction-publique.gouv.fr/files/files/statistiques/rapports_annuels/2016/G_Liste_des_sigles.pdf
EPORA,Etablissement public foncier de l'Ouest Rhône-Alpes,Sénat,https://www.senat.fr/histoire/sigles.html
EPP,Evaluation des Pratiques Professionnelles,L. Bohu - maraudes.fr,http://maraudes.fr/glossaire-sigles-social-de-sante-de-ladministration/
EPPM,Enquéte Permanente sur la Prescription Médicale,L. Bohu - maraudes.fr,http://maraudes.fr/glossaire-sigles-social-de-sante-de-ladministration/
EPR,Établissement public régional,M. Lafay - CCE-LR,http://www.cce-lrv.com/documents/images/general_photos/151_Fichier.pdf
EPR,Réacteur européen à eau pressurisée,Sénat,https://www.senat.fr/histoire/sigles.html
EPRD,Etat prévisionnel des dépenses et des recettes,DGOS,http://www.metiers-fonctionpubliquehospitaliere.sante.gouv.fr/Lexique-des-abreviations-ou-sigles.html
EPS,Éducation physique et sportive,Sénat,https://www.senat.fr/histoire/sigles.html
EPS,Établissement Public de Santé,L. Bohu - maraudes.fr,http://maraudes.fr/glossaire-sigles-social-de-sante-de-ladministration/
EPSCP,"Etablissement public à caractère scientifique, culturel et professionnel",Sénat,https://www.senat.fr/histoire/sigles.html
EPSM,établissement Public de Santé Mentale (ex CHS),L. Bohu - maraudes.fr,http://maraudes.fr/glossaire-sigles-social-de-sante-de-ladministration/
EPSR,Equipe de préparation et de suite du reclassement des personnes handicapées,L. Bohu - maraudes.fr,http://maraudes.fr/glossaire-sigles-social-de-sante-de-ladministration/
EPSS,École Pratique De Service Social,L. Bohu - maraudes.fr,http://maraudes.fr/glossaire-sigles-social-de-sante-de-ladministration/
EPST,Etablissement public à caractère scientifique et technique,Sénat,https://www.senat.fr/histoire/sigles.html
EPTB,Etablissement public territorial de bassin,Sénat,https://www.senat.fr/histoire/sigles.html
EPU,Enseignement postuniversitaire,Keratocone,https://www.keratocone.net/acronymes.html
EQTP,Équivalents temps plein annualisés,DGAFP,https://www.fonction-publique.gouv.fr/files/files/statistiques/rapports_annuels/2016/G_Liste_des_sigles.pdf
ER,Emplacement réservé,M. Lafay - CCE-LR,http://www.cce-lrv.com/documents/images/general_photos/151_Fichier.pdf
ER,Énergie renouvelable,M. Lafay - CCE-LR,http://www.cce-lrv.com/documents/images/general_photos/151_Fichier.pdf
ER,Enseignant Référent,L. Bohu - maraudes.fr,http://maraudes.fr/glossaire-sigles-social-de-sante-de-ladministration/
ERA-NET,E-Rare European Research Area Network sur les maladies rares,Keratocone,https://www.keratocone.net/acronymes.html
ERAFP,Établissement de retraite additionnelle de la fonction publique,DGAFP,https://www.fonction-publique.gouv.fr/files/files/statistiques/rapports_annuels/2016/G_Liste_des_sigles.pdf
ERAP,Entreprise de recherche et d'activités pétrolières,Sénat,https://www.senat.fr/histoire/sigles.html
ERASME,"Extraction, Recherche et Analyse pour un Suivi Médico-Économique",L. Bohu - maraudes.fr,http://maraudes.fr/glossaire-sigles-social-de-sante-de-ladministration/
ERASMUS,Programme d'action de la communauté européenne en matière de mobilité des étudiants universitaires.,M. Lafay - CCE-LR,http://www.cce-lrv.com/documents/images/general_photos/151_Fichier.pdf
ERD,Électricité réseau de distribution,M. Lafay - CCE-LR,http://www.cce-lrv.com/documents/images/general_photos/151_Fichier.pdf
ERDF,Électricité réseau distribution France,M. Lafay - CCE-LR,http://www.cce-lrv.com/documents/images/general_photos/151_Fichier.pdf
ERDV,Etablissement régional pour déficients visuels,L. Bohu - maraudes.fr,http://maraudes.fr/glossaire-sigles-social-de-sante-de-ladministration/
EREA,Etablissement Régional d’Enseignement Adapté,L. Bohu - maraudes.fr,http://maraudes.fr/glossaire-sigles-social-de-sante-de-ladministration/
ERIS,Equipe Régionale d'Intervention et de Sécurité,Denis Merigoux,https://gist.github.com/ColinMaudry/fe30f024d3cea20d1f6ccd579d9acd3f#file-gendarmerie-csv
ERNT,Etat des risques naturels technologiques,M. Lafay - CCE-LR,http://www.cce-lrv.com/documents/images/general_photos/151_Fichier.pdf
ERP,Enterprise Resource Planning (progiciel de gestion intégré),beta.gouv.fr,https://github.com/betagouv/glossary-bot
ERP,Établissement recevant du public,M. Lafay - CCE-LR,http://www.cce-lrv.com/documents/images/general_photos/151_Fichier.pdf
ERTS,Ecole regionale en travail social,L. Bohu - maraudes.fr,http://maraudes.fr/glossaire-sigles-social-de-sante-de-ladministration/
ES,Educateur Spécialisé,L. Bohu - maraudes.fr,http://maraudes.fr/glossaire-sigles-social-de-sante-de-ladministration/
ESA,European Space Agency,L. Bohu - maraudes.fr,http://maraudes.fr/glossaire-sigles-social-de-sante-de-ladministration/
ESAT,Établissement et Service d’Aide par le Travail (anciennement CAT),L. Bohu - maraudes.fr,http://maraudes.fr/glossaire-sigles-social-de-sante-de-ladministration/
ESB,Encéphalopathie spongiforme bovine,Sénat,https://www.senat.fr/histoire/sigles.html
ESEN,École supérieure de l’éducation nationale,L. Bohu - maraudes.fr,http://maraudes.fr/glossaire-sigles-social-de-sante-de-ladministration/
ESF,Économie sociale et familiale,L. Bohu - maraudes.fr,http://maraudes.fr/glossaire-sigles-social-de-sante-de-ladministration/
ESHM,École Spéciale pour Handicapés Moteurs,L. Bohu - maraudes.fr,http://maraudes.fr/glossaire-sigles-social-de-sante-de-ladministration/
ESI,Étranger en Situation Irrégulière,Denis Merigoux,https://gist.github.com/ColinMaudry/fe30f024d3cea20d1f6ccd579d9acd3f#file-gendarmerie-csv
ESMS,établissements et Services sociaux et Médico-Sociaux,L. Bohu - maraudes.fr,http://maraudes.fr/glossaire-sigles-social-de-sante-de-ladministration/
ESO,Economique et Sociale,L. Bohu - maraudes.fr,http://maraudes.fr/glossaire-sigles-social-de-sante-de-ladministration/
ESOG,École de Sous-Officiers de Gendarmerie,Denis Merigoux,https://gist.github.com/ColinMaudry/fe30f024d3cea20d1f6ccd579d9acd3f#file-gendarmerie-csv
ESP,Espace service public.,M. Lafay - CCE-LR,http://www.cce-lrv.com/documents/images/general_photos/151_Fichier.pdf
ESPIC,Établissement de santé privé d’intérêt collectif (dans le cadre de la loi HPST),L. Bohu - maraudes.fr,http://maraudes.fr/glossaire-sigles-social-de-sante-de-ladministration/
ESQ,Etudes d'esquisse,marche-public.fr,http://www.marche-public.fr/Marches-publics/Definitions/Marches-publics-Sigles.htm
ESR,Engagement au Service de Réserve,Denis Merigoux,https://gist.github.com/ColinMaudry/fe30f024d3cea20d1f6ccd579d9acd3f#file-gendarmerie-csv
ESS,Économie sociale et solidaire,beta.gouv.fr,https://github.com/betagouv/glossary-bot
ESSMS,Établissements Et Services Sociaux Et Médico-sociaux,L. Bohu - maraudes.fr,http://maraudes.fr/glossaire-sigles-social-de-sante-de-ladministration/
ESTHER,Ensemble pour une Solidarité Thérapeutique Hospitalière en Réseau,L. Bohu - maraudes.fr,http://maraudes.fr/glossaire-sigles-social-de-sante-de-ladministration/
ETC,Employé technique de collectivité,DGOS,http://www.metiers-fonctionpubliquehospitaliere.sante.gouv.fr/Lexique-des-abreviations-ou-sigles.html
ETI,Enquêteur Travail Illégal,Denis Merigoux,https://gist.github.com/ColinMaudry/fe30f024d3cea20d1f6ccd579d9acd3f#file-gendarmerie-csv
ETP,Éducation Thérapeutique du Patient,L. Bohu - maraudes.fr,http://maraudes.fr/glossaire-sigles-social-de-sante-de-ladministration/
ETP,Équivalent temps plein,Ministère de la Justice,http://www.justice.gouv.fr/art_pix/Stat_Annuaire_ministere-justice_sigles.pdf
ETP,Etablissement de travail protégé,L. Bohu - maraudes.fr,http://maraudes.fr/glossaire-sigles-social-de-sante-de-ladministration/
ETPE,Équivalent temps plein emploi,DGAFP,https://www.fonction-publique.gouv.fr/files/files/statistiques/rapports_annuels/2016/G_Liste_des_sigles.pdf
ETPF,Équivalent temps plein financier,DGAFP,https://www.fonction-publique.gouv.fr/files/files/statistiques/rapports_annuels/2016/G_Liste_des_sigles.pdf
ETPR,Équivalent temps plein rémunéré,DGAFP,https://www.fonction-publique.gouv.fr/files/files/statistiques/rapports_annuels/2016/G_Liste_des_sigles.pdf
ETPT,Equivalents temps plein travaillés,Sénat,https://www.senat.fr/histoire/sigles.html
ETR,Equipe technique de reclassement,L. Bohu - maraudes.fr,http://maraudes.fr/glossaire-sigles-social-de-sante-de-ladministration/
ETS,Educateur technique spécialisé,DGOS,http://www.metiers-fonctionpubliquehospitaliere.sante.gouv.fr/Lexique-des-abreviations-ou-sigles.html
ETS,Établissement de santé,M. Lafay - CCE-LR,http://www.cce-lrv.com/documents/images/general_photos/151_Fichier.pdf
ETSI,European Telecommunications Standards Institute (Voir : organismes de normalisation),marche-public.fr,http://www.marche-public.fr/Marches-publics/Definitions/Marches-publics-Sigles.htm
ETT,Entreprise de travail temporaire,L. Bohu - maraudes.fr,http://maraudes.fr/glossaire-sigles-social-de-sante-de-ladministration/
ETTI,Entreprises de travail temporaire d'insertion,Sénat,https://www.senat.fr/histoire/sigles.html
EUMESTAT,European Meteorology Satellite (Organisation européenne pour l'exploitation de satellites météorologiques),Sénat,https://www.senat.fr/histoire/sigles.html
EURATOM,Communauté européenne de l'Énergie atomique.,M. Lafay - CCE-LR,http://www.cce-lrv.com/documents/images/general_photos/151_Fichier.pdf
EUREKA,European research coordination agency (Agence de coordination pour la recherche européenne),Sénat,https://www.senat.fr/histoire/sigles.html
EURL,Entreprise unipersonnelle à responsabilité limitée,Sénat,https://www.senat.fr/histoire/sigles.html
EUTELSAT,European telecommunications satellite organisation (Organisation européenne de télécommunications par satellite),Sénat,https://www.senat.fr/histoire/sigles.html
EVA,Echelle Visuelle Analogique,L. Bohu - maraudes.fr,http://maraudes.fr/glossaire-sigles-social-de-sante-de-ladministration/
EVS,Emploi de vie scolaire,Sénat,https://www.senat.fr/histoire/sigles.html
EXE,études d'EXEcution et de synthèse,marche-public.fr,http://www.marche-public.fr/Marches-publics/Definitions/Marches-publics-Sigles.htm
Eurordis,European Organization for Rare Diseases,Keratocone,https://www.keratocone.net/acronymes.html
FA,Famille D’accueil,L. Bohu - maraudes.fr,http://maraudes.fr/glossaire-sigles-social-de-sante-de-ladministration/
FAAS,Fonds additionnel d'action sociale,Sénat,https://www.senat.fr/histoire/sigles.html
FACE,Fonds d'amortissement des charges d'électrification,Sénat,https://www.senat.fr/histoire/sigles.html
FACT,Fonds d'amélioration des conditions de travail,Sénat,https://www.senat.fr/histoire/sigles.html
FAD,Formation À Distance,Denis Merigoux,https://gist.github.com/ColinMaudry/fe30f024d3cea20d1f6ccd579d9acd3f#file-gendarmerie-csv
FADIL,Fonds d'aide au développement de l'intérieur et des îles,Sénat,https://www.senat.fr/histoire/sigles.html
FAE,Foyer d’action éducatif,L. Bohu - maraudes.fr,http://maraudes.fr/glossaire-sigles-social-de-sante-de-ladministration/
FAED,Fichier automatisé des empreintes digitales,Sénat,https://www.senat.fr/histoire/sigles.html
FAED,Fichier Automatisé d'Empreintes Digitales,Denis Merigoux,https://gist.github.com/ColinMaudry/fe30f024d3cea20d1f6ccd579d9acd3f#file-gendarmerie-csv
FAF,Fond d’action formation,L. Bohu - maraudes.fr,http://maraudes.fr/glossaire-sigles-social-de-sante-de-ladministration/
FAG,Force Aérienne de la Gendarmerie,Denis Merigoux,https://gist.github.com/ColinMaudry/fe30f024d3cea20d1f6ccd579d9acd3f#file-gendarmerie-csv
FAGE,Fédération des Associations Générales Etudiantes,FAGE,https://www.fage.org/les-assos-etudiantes/presentation/
FAGERH,Fédération des associations gestionnaires d’établissements de réadaptation pour handicapés,L. Bohu - maraudes.fr,http://maraudes.fr/glossaire-sigles-social-de-sante-de-ladministration/
FAI,Fonds d'aide à l'investissement,Sénat,https://www.senat.fr/histoire/sigles.html
FAI,Fonds d'aide à l'innovation,Sénat,https://www.senat.fr/histoire/sigles.html
FAIJ,Fond d’aide à l’insertion des jeunes,L. Bohu - maraudes.fr,http://maraudes.fr/glossaire-sigles-social-de-sante-de-ladministration/
FAIL,Fonds d’aides aux impayés de loyer,L. Bohu - maraudes.fr,http://maraudes.fr/glossaire-sigles-social-de-sante-de-ladministration/
FAIP,Formateur Accompagnateur En Insertion Professionnelle,L. Bohu - maraudes.fr,http://maraudes.fr/glossaire-sigles-social-de-sante-de-ladministration/
FAJ,Fond d’Aide aux Jeunes,L. Bohu - maraudes.fr,http://maraudes.fr/glossaire-sigles-social-de-sante-de-ladministration/
FAM,Foyer d’Accueil Médicalisé,L. Bohu - maraudes.fr,http://maraudes.fr/glossaire-sigles-social-de-sante-de-ladministration/
FAMAS,Fusil d’Assaut de la Manufacture d'Armes de Saint-Étienne,Denis Merigoux,https://gist.github.com/ColinMaudry/fe30f024d3cea20d1f6ccd579d9acd3f#file-gendarmerie-csv
FAMEXA,Fonds Social De L’assurance Maladie Des EXploitants Agricoles,L. Bohu - maraudes.fr,http://maraudes.fr/glossaire-sigles-social-de-sante-de-ladministration/
FAMPHV,Foyer d’Accueil Médicalisé pour Personnes Handicapées Vieillissantes,L. Bohu - maraudes.fr,http://maraudes.fr/glossaire-sigles-social-de-sante-de-ladministration/
FAO,Food and agriculture organisation (Organisation des Nations unies pour l'alimentation et l'agriculture),Sénat,https://www.senat.fr/histoire/sigles.html
FAP,Fondation Abbé Pierre,L. Bohu - maraudes.fr,http://maraudes.fr/glossaire-sigles-social-de-sante-de-ladministration/
FAP,Fusil À Pompe,Denis Merigoux,https://gist.github.com/ColinMaudry/fe30f024d3cea20d1f6ccd579d9acd3f#file-gendarmerie-csv
FAQSV,Fonds d'aide à la qualité des soins de ville,Sénat,https://www.senat.fr/histoire/sigles.html
FAR,Fonds d'aménagement rural.,M. Lafay - CCE-LR,http://www.cce-lrv.com/documents/images/general_photos/151_Fichier.pdf
FAR,Force d'action rapide,Sénat,https://www.senat.fr/histoire/sigles.html
FARD,Fonds d’aide aux accédants à la propriété en difficulté,L. Bohu - maraudes.fr,http://maraudes.fr/glossaire-sigles-social-de-sante-de-ladministration/
FARG,Fonds d’aide au relogement et de garantie,L. Bohu - maraudes.fr,http://maraudes.fr/glossaire-sigles-social-de-sante-de-ladministration/
FARI,Fonds d'aide à la recherche et à l'innovation,Sénat,https://www.senat.fr/histoire/sigles.html
FARIF,Fonds d’aménagement de la région Ile-de-France,Sénat,https://www.senat.fr/histoire/sigles.html
FARIT,Fonds d'aide à la recherche et à l'innovation dans les transports,Sénat,https://www.senat.fr/histoire/sigles.html
FARU,Fonds d'aide au relogement d'urgence,Sénat,https://www.senat.fr/histoire/sigles.html
FAS,Fonds d'action sociale pour les travailleurs immigrés et leurs familles,Sénat,https://www.senat.fr/histoire/sigles.html
FASASA,Fonds d'action sociale pour l'aménagement des structures agricoles,Sénat,https://www.senat.fr/histoire/sigles.html
FASID,Fonds d’action et de soutien pour l’intégration et la lutte contre les discriminations,L. Bohu - maraudes.fr,http://maraudes.fr/glossaire-sigles-social-de-sante-de-ladministration/
FASILD,Fonds d'action et de soutien pour l'intégration et la lutte contre les discriminations,Sénat,https://www.senat.fr/histoire/sigles.html
FASS,Fonds d'action sanitaire et sociale,Sénat,https://www.senat.fr/histoire/sigles.html
FASTT,Fonds d’Action Sociale du Travail Temporaire,L. Bohu - maraudes.fr,http://maraudes.fr/glossaire-sigles-social-de-sante-de-ladministration/
FATAC,Force aérienne tactique,Sénat,https://www.senat.fr/histoire/sigles.html
FATH,Foyer pour Adultes Travailleurs Handicapés,L. Bohu - maraudes.fr,http://maraudes.fr/glossaire-sigles-social-de-sante-de-ladministration/
FAU,Fonds d'aménagement urbain,Sénat,https://www.senat.fr/histoire/sigles.html
FAU,Forfait d’accueil des Urgences,L. Bohu - maraudes.fr,http://maraudes.fr/glossaire-sigles-social-de-sante-de-ladministration/
FBCF,Formation brute de capital fixe,Sénat,https://www.senat.fr/histoire/sigles.html
FBF,Fédération bancaire française.,M. Lafay - CCE-LR,http://www.cce-lrv.com/documents/images/general_photos/151_Fichier.pdf
FBI,foncier bâti industriel,L. Bohu - maraudes.fr,http://maraudes.fr/glossaire-sigles-social-de-sante-de-ladministration/
FCA,France Connect Agent,beta.gouv.fr,https://github.com/betagouv/glossary-bot
FCAATA,Fonds de cessation anticipée d'activité des travailleurs de l'amiante,Sénat,https://www.senat.fr/histoire/sigles.html
FCC,Formation Continue Conventionnelle,L. Bohu - maraudes.fr,http://maraudes.fr/glossaire-sigles-social-de-sante-de-ladministration/
FCE,Forces Conventionnelles en Europe,Denis Merigoux,https://gist.github.com/ColinMaudry/fe30f024d3cea20d1f6ccd579d9acd3f#file-gendarmerie-csv
FCIL,Formation Complémentaire d’Initiative Locale,L. Bohu - maraudes.fr,http://maraudes.fr/glossaire-sigles-social-de-sante-de-ladministration/
FCPE,Fonds communs de placement d'entreprise,Sénat,https://www.senat.fr/histoire/sigles.html
FCPI,Fonds communs de placement dans l'innovation,Sénat,https://www.senat.fr/histoire/sigles.html
FCPP,Fonds communs de placement de proximité,Sénat,https://www.senat.fr/histoire/sigles.html
FCS,Fournitures Courantes et Services,marche-public.fr,http://www.marche-public.fr/Marches-publics/Definitions/Marches-publics-Sigles.htm
FCSB,,L. Bohu - maraudes.fr,http://maraudes.fr/glossaire-sigles-social-de-sante-de-ladministration/
FCSF,La Fédération des centres sociaux (et socioculturels) de France,L. Bohu - maraudes.fr,http://maraudes.fr/glossaire-sigles-social-de-sante-de-ladministration/
FCSSC,Fédération des centres sociaux et socio-culturels,L. Bohu - maraudes.fr,http://maraudes.fr/glossaire-sigles-social-de-sante-de-ladministration/
FCTVA,Fonds de compensation pour la TVA,Sénat,https://www.senat.fr/histoire/sigles.html
FDA,Food and Drug Administration,Keratocone,https://www.keratocone.net/acronymes.html
FDCH,Fonds Départemental de Compensation du Handicap,L. Bohu - maraudes.fr,http://maraudes.fr/glossaire-sigles-social-de-sante-de-ladministration/
FDCR,Fonds de correction des déséquilibres régionaux,Sénat,https://www.senat.fr/histoire/sigles.html
FDES,Fonds de développement économique et social,Sénat,https://www.senat.fr/histoire/sigles.html
FDF,Fondation de France,L. Bohu - maraudes.fr,http://maraudes.fr/glossaire-sigles-social-de-sante-de-ladministration/
FDIT,Fonds pour le développement de l'intermodalité dans les transports,Sénat,https://www.senat.fr/histoire/sigles.html
FDPTP,Fonds départemental de péréquation de la taxe professionnelle,Sénat,https://www.senat.fr/histoire/sigles.html
FDR,Feuille De Route,Denis Merigoux,https://gist.github.com/ColinMaudry/fe30f024d3cea20d1f6ccd579d9acd3f#file-gendarmerie-csv
FDT,Foyer Double Tarification (devenu FAM),L. Bohu - maraudes.fr,http://maraudes.fr/glossaire-sigles-social-de-sante-de-ladministration/
FDV,Foyer De Vie,L. Bohu - maraudes.fr,http://maraudes.fr/glossaire-sigles-social-de-sante-de-ladministration/
FEADER,Fonds Européen agricole pour le développement rural,M. Lafay - CCE-LR,http://www.cce-lrv.com/documents/images/general_photos/151_Fichier.pdf
FEAH,Foyer d’Hébergement pour Adultes Handicapés,L. Bohu - maraudes.fr,http://maraudes.fr/glossaire-sigles-social-de-sante-de-ladministration/
FEC,Fonds d'égalisation des charges,Sénat,https://www.senat.fr/histoire/sigles.html
FECL,Fonds d'équipement des collectivités locales,Sénat,https://www.senat.fr/histoire/sigles.html
FECOM,Fonds européen de coopération monétaire.,M. Lafay - CCE-LR,http://www.cce-lrv.com/documents/images/general_photos/151_Fichier.pdf
FED,Fonds européen de développement,Sénat,https://www.senat.fr/histoire/sigles.html
FEDER,Fonds européen de développement régional,Sénat,https://www.senat.fr/histoire/sigles.html
FEDOM,Fonds pour l'emploi dans les départements d'outre-mer,Sénat,https://www.senat.fr/histoire/sigles.html
FEE,France énergie éolienne.,M. Lafay - CCE-LR,http://www.cce-lrv.com/documents/images/general_photos/151_Fichier.pdf
