term,definition,source,url_source
CFDD,Conseil fédéral du développement durable.,M. Lafay - CCE-LR,http://www.cce-lrv.com/documents/images/general_photos/151_Fichier.pdf
CFDT,Confédération française démocratique du travail,Sénat,https://www.senat.fr/histoire/sigles.html
CFDT,Confédération française des travailleurs,L. Bohu - maraudes.fr,http://maraudes.fr/glossaire-sigles-social-de-sante-de-ladministration/
CFDU,Conseil français des urbanistes.,M. Lafay - CCE-LR,http://www.cce-lrv.com/documents/images/general_photos/151_Fichier.pdf
CFE,centre de formalité des entreprises,L. Bohu - maraudes.fr,http://maraudes.fr/glossaire-sigles-social-de-sante-de-ladministration/
CFE,Comptabilité Et Finance D’entreprise,L. Bohu - maraudes.fr,http://maraudes.fr/glossaire-sigles-social-de-sante-de-ladministration/
CFE,Cotisation foncière des entreprises,beta.gouv.fr,https://github.com/betagouv/glossary-bot
CFE-CGC,Confédération française de l'encadrement - Confédération générale des cadres,Sénat,https://www.senat.fr/histoire/sigles.html
CFES,Comité français d’éducation pour la santé,L. Bohu - maraudes.fr,http://maraudes.fr/glossaire-sigles-social-de-sante-de-ladministration/
CFGB,Comité Français des grands barrages,M. Lafay - CCE-LR,http://www.cce-lrv.com/documents/images/general_photos/151_Fichier.pdf
CFHE,Conseil français des personnes handicapées pour les questions européennes,L. Bohu - maraudes.fr,http://maraudes.fr/glossaire-sigles-social-de-sante-de-ladministration/
CFI,Crédit formation individualisé,L. Bohu - maraudes.fr,http://maraudes.fr/glossaire-sigles-social-de-sante-de-ladministration/
CFL,Comité des finances locales,Sénat,https://www.senat.fr/histoire/sigles.html
CFM,Championnat de France Militaire,Denis Merigoux,https://gist.github.com/ColinMaudry/fe30f024d3cea20d1f6ccd579d9acd3f#file-gendarmerie-csv
CFMG,Conseil de la Fonction Militaire de la Gendarmerie,Denis Merigoux,https://gist.github.com/ColinMaudry/fe30f024d3cea20d1f6ccd579d9acd3f#file-gendarmerie-csv
CFP,Compagnie française des pétroles,Sénat,https://www.senat.fr/histoire/sigles.html
CFP,Concours Force Publique,L. Bohu - maraudes.fr,http://maraudes.fr/glossaire-sigles-social-de-sante-de-ladministration/
CFP,Congé de formation professionnelle,L. Bohu - maraudes.fr,http://maraudes.fr/glossaire-sigles-social-de-sante-de-ladministration/
CFPC,Centre de formation des personnels communaux,Sénat,https://www.senat.fr/histoire/sigles.html
CFPET,Centre de Formation des Professeurs de l’Enseignement Technique,L. Bohu - maraudes.fr,http://maraudes.fr/glossaire-sigles-social-de-sante-de-ladministration/
CFPI,Commission de la fonction publique internationale,M. Lafay - CCE-LR,http://www.cce-lrv.com/documents/images/general_photos/151_Fichier.pdf
CFPPA,Centre de Formation Professionnelle et de Promotion Agricoles,L. Bohu - maraudes.fr,http://maraudes.fr/glossaire-sigles-social-de-sante-de-ladministration/
CFTA,Centre de formation de techniciens agricoles,M. Lafay - CCE-LR,http://www.cce-lrv.com/documents/images/general_photos/151_Fichier.pdf
CFTC,Confédération française des travailleurs chrétiens,Sénat,https://www.senat.fr/histoire/sigles.html
CFTS,Centre de Formation au Travail social (ou de Travailleurs Sociaux),L. Bohu - maraudes.fr,http://maraudes.fr/glossaire-sigles-social-de-sante-de-ladministration/
CG,Conseil Général,L. Bohu - maraudes.fr,http://maraudes.fr/glossaire-sigles-social-de-sante-de-ladministration/
CGA,Centre de gestion Agrée.,M. Lafay - CCE-LR,http://www.cce-lrv.com/documents/images/general_photos/151_Fichier.pdf
CGB,Commission d'étude de la dissémination des produits issus du génie biomoléculaire,M. Lafay - CCE-LR,http://www.cce-lrv.com/documents/images/general_photos/151_Fichier.pdf
CGC,Confédération française de l'encadrement,DGAFP,https://www.fonction-publique.gouv.fr/files/files/statistiques/rapports_annuels/2016/G_Liste_des_sigles.pdf
CGCT,Code Général des Collectivités Territoriales,marche-public.fr,http://www.marche-public.fr/Marches-publics/Definitions/Marches-publics-Sigles.htm
CGCT,Compagnie générale de construction téléphonique,Sénat,https://www.senat.fr/histoire/sigles.html
CGD,Compagnie de Gendarmerie Départementale,Denis Merigoux,https://gist.github.com/ColinMaudry/fe30f024d3cea20d1f6ccd579d9acd3f#file-gendarmerie-csv
CGDD,Commissariat général au développement durable,Ministère de la Transition écologique,https://www.ecologique-solidaire.gouv.fr/commissariat-general-au-developpement-durable-cgdd
CGE,Compagnie générale d'électricité,Sénat,https://www.senat.fr/histoire/sigles.html
CGE,Conférence des grandes écoles,CGE,https://www.cge.asso.fr/
CGEDD,Conseil Général de l’Environnement et du Développement Durable,marche-public.fr,http://www.marche-public.fr/Marches-publics/Definitions/Marches-publics-Sigles.htm
CGEF,Contrôle général économique et financier,DGAFP,https://www.fonction-publique.gouv.fr/files/files/statistiques/rapports_annuels/2016/G_Liste_des_sigles.pdf
CGET,Commissariat général à l'égalité des territoires,beta.gouv.fr,https://github.com/betagouv/glossary-bot
CGG,Commission du génie génétique,M. Lafay - CCE-LR,http://www.cce-lrv.com/documents/images/general_photos/151_Fichier.pdf
CGGREF,"Conseil général du génie rural, des eaux et des forêts.",M. Lafay - CCE-LR,http://www.cce-lrv.com/documents/images/general_photos/151_Fichier.pdf
CGI,Code général des impôts,Sénat,https://www.senat.fr/histoire/sigles.html
CGLLS,Caisse de garantie du logement locatif social,Sénat,https://www.senat.fr/histoire/sigles.html
CGLPL,Contrôleur Général des Lieux de Privation de Liberté,Denis Merigoux,https://gist.github.com/ColinMaudry/fe30f024d3cea20d1f6ccd579d9acd3f#file-gendarmerie-csv
CGLS,Caisse de garantie du logement social,Sénat,https://www.senat.fr/histoire/sigles.html
CGMAR,Commandant de la Gendarmerie MARitime,Denis Merigoux,https://gist.github.com/ColinMaudry/fe30f024d3cea20d1f6ccd579d9acd3f#file-gendarmerie-csv
CGOM,Commandant de la Gendarmerie d'Outre-Mer,Denis Merigoux,https://gist.github.com/ColinMaudry/fe30f024d3cea20d1f6ccd579d9acd3f#file-gendarmerie-csv
CGP,Commissariat général du plan.,M. Lafay - CCE-LR,http://www.cce-lrv.com/documents/images/general_photos/151_Fichier.pdf
CGPC,Conseil général des ponts et chaussées,CNLES,https://www.cnle.gouv.fr/Sigles-de-l-Administration.html
CGPM,Commission générale des pêches pour la Méditerranée,Sénat,https://www.senat.fr/histoire/sigles.html
CGPME,Confédération générale des petites et moyennes entreprises,Sénat,https://www.senat.fr/histoire/sigles.html
CGSCOP,Confédération Générale Des Scop,L. Bohu - maraudes.fr,http://maraudes.fr/glossaire-sigles-social-de-sante-de-ladministration/
CGSS,Caisse Générale de sécurité Sociale,L. Bohu - maraudes.fr,http://maraudes.fr/glossaire-sigles-social-de-sante-de-ladministration/
CGT,Confédération générale du travail,Sénat,https://www.senat.fr/histoire/sigles.html
CGT-FO,Confédération générale du travail-Force ouvrière,Sénat,https://www.senat.fr/histoire/sigles.html
CGTI,Conseil général des technologies de l'information,Sénat,https://www.senat.fr/histoire/sigles.html
CH,Centre hospitalier,DGAFP,https://www.fonction-publique.gouv.fr/files/files/statistiques/rapports_annuels/2016/G_Liste_des_sigles.pdf
CHA,Centre d’hygiène alimentaire voir aussi ( CHAA),L. Bohu - maraudes.fr,http://maraudes.fr/glossaire-sigles-social-de-sante-de-ladministration/
CHAA,Centre d’hygiène alimentaire et d’alcoologie,L. Bohu - maraudes.fr,http://maraudes.fr/glossaire-sigles-social-de-sante-de-ladministration/
CHD,Centre Hospitalier Départemental,L. Bohu - maraudes.fr,http://maraudes.fr/glossaire-sigles-social-de-sante-de-ladministration/
CHEAR,Centre des hautes études de l'armement,Sénat,https://www.senat.fr/histoire/sigles.html
CHG,Centre hospitalier général,L. Bohu - maraudes.fr,http://maraudes.fr/glossaire-sigles-social-de-sante-de-ladministration/
CHR,Centre hospitalier régional,Sénat,https://www.senat.fr/histoire/sigles.html
CHRS,Centre d'hébergement et de réinsertion sociale,Sénat,https://www.senat.fr/histoire/sigles.html
CHRS,Centre d’Hébergement et de réadaptation sociale,L. Bohu - maraudes.fr,http://maraudes.fr/glossaire-sigles-social-de-sante-de-ladministration/
CHRU,Centre hospitalier régional universitaire.,M. Lafay - CCE-LR,http://www.cce-lrv.com/documents/images/general_photos/151_Fichier.pdf
CHS,Centre hospitalier spécialisé,DGAFP,https://www.fonction-publique.gouv.fr/files/files/statistiques/rapports_annuels/2016/G_Liste_des_sigles.pdf
CHS,Comité hygiène et sécurité,DGAFP,https://www.fonction-publique.gouv.fr/files/files/statistiques/rapports_annuels/2016/G_Liste_des_sigles.pdf
CHS,Commission d'hygiène et sécurité.,M. Lafay - CCE-LR,http://www.cce-lrv.com/documents/images/general_photos/151_Fichier.pdf
CHSC,Comité hygiène et sécurité central,DGAFP,https://www.fonction-publique.gouv.fr/files/files/statistiques/rapports_annuels/2016/G_Liste_des_sigles.pdf
CHSCT,"Comité d'hygiène, de sécurité et des conditions de travail",Sénat,https://www.senat.fr/histoire/sigles.html
CHSD,Comité d'hygiène et sécurité départemental.,M. Lafay - CCE-LR,http://www.cce-lrv.com/documents/images/general_photos/151_Fichier.pdf
CHSLD,Centre d’Hébergement Et De Soins De Longue Durée,L. Bohu - maraudes.fr,http://maraudes.fr/glossaire-sigles-social-de-sante-de-ladministration/
CHSM,Comité hygiène et sécurité ministériel,DGAFP,https://www.fonction-publique.gouv.fr/files/files/statistiques/rapports_annuels/2016/G_Liste_des_sigles.pdf
CHU,Centre D’hébergement D’urgence,L. Bohu - maraudes.fr,http://maraudes.fr/glossaire-sigles-social-de-sante-de-ladministration/
CHU,Centre hospitalier universitaire,Sénat,https://www.senat.fr/histoire/sigles.html
CI,Chambre d’Isolement,L. Bohu - maraudes.fr,http://maraudes.fr/glossaire-sigles-social-de-sante-de-ladministration/
CI-RMA,Contrat insertion - Revenu minimum d'activité,Sénat,https://www.senat.fr/histoire/sigles.html
CIACT,Comité interministériel d'aménagement et de compétitivité du territoire.,M. Lafay - CCE-LR,http://www.cce-lrv.com/documents/images/general_photos/151_Fichier.pdf
CIAD,Centre d’Information et d’Accueil Départemental,L. Bohu - maraudes.fr,http://maraudes.fr/glossaire-sigles-social-de-sante-de-ladministration/
CIADT,Comité interministériel d'aménagement et de développement du territoire,Sénat,https://www.senat.fr/histoire/sigles.html
CIANE,Comité interministériel d'aménagement de la nature et de l'environnement.,M. Lafay - CCE-LR,http://www.cce-lrv.com/documents/images/general_photos/151_Fichier.pdf
CIAPT,Certificat d'Initiation et d'Aptitude au Tir,Denis Merigoux,https://gist.github.com/ColinMaudry/fe30f024d3cea20d1f6ccd579d9acd3f#file-gendarmerie-csv
CIAS,Centre intercommunal d'action sociale,Sénat,https://www.senat.fr/histoire/sigles.html
CIAT,Comité interministériel pour l'aménagement du territoire,Sénat,https://www.senat.fr/histoire/sigles.html
CIBC,Centres interministériels de bilans de compétences,Sénat,https://www.senat.fr/histoire/sigles.html
CIC,Centre d’Investigation Clinique,L. Bohu - maraudes.fr,http://maraudes.fr/glossaire-sigles-social-de-sante-de-ladministration/
CIC,Cellule d'Investigation Criminelle,Denis Merigoux,https://gist.github.com/ColinMaudry/fe30f024d3cea20d1f6ccd579d9acd3f#file-gendarmerie-csv
CICAS,Centre d’information et de coordination de l’action sociale (des régimes de retraite),L. Bohu - maraudes.fr,http://maraudes.fr/glossaire-sigles-social-de-sante-de-ladministration/
CICAT,Centre d’information et de conseil sur les aides techniques,L. Bohu - maraudes.fr,http://maraudes.fr/glossaire-sigles-social-de-sante-de-ladministration/
CICID,Comité interministériel de la coopération internationale et du développement,Sénat,https://www.senat.fr/histoire/sigles.html
CICR,Comité international de la Croix-Rouge,Sénat,https://www.senat.fr/histoire/sigles.html
CIDAR,Comité interministériel de développement et d'aménagement rural,Sénat,https://www.senat.fr/histoire/sigles.html
CIDB,Centre d'information et de documentation sur le bruit.,M. Lafay - CCE-LR,http://www.cce-lrv.com/documents/images/general_photos/151_Fichier.pdf
CIDCE,Centre international de droit comparé de l'environnement,M. Lafay - CCE-LR,http://www.cce-lrv.com/documents/images/general_photos/151_Fichier.pdf
CIDD,Comité interministériel du développement durable.,M. Lafay - CCE-LR,http://www.cce-lrv.com/documents/images/general_photos/151_Fichier.pdf
CIDDIST,Centre d’Information de Dépistage et de Diagnostic des Infections Sexuellement Transmissibles,L. Bohu - maraudes.fr,http://maraudes.fr/glossaire-sigles-social-de-sante-de-ladministration/
CIDE,Convention Internationale Des Droits De L’enfant,L. Bohu - maraudes.fr,http://maraudes.fr/glossaire-sigles-social-de-sante-de-ladministration/
CIDFF,Centre d’Information des Droits des Femmes et de la Famille,L. Bohu - maraudes.fr,http://maraudes.fr/glossaire-sigles-social-de-sante-de-ladministration/
CIDISE,Comité interministériel pour le développement des investissements et le soutien de l'emploi,Sénat,https://www.senat.fr/histoire/sigles.html
CIDJ,Centre d’information et de documentation de la jeunesse,L. Bohu - maraudes.fr,http://maraudes.fr/glossaire-sigles-social-de-sante-de-ladministration/
CIDOL,Comité interministériel pour le développement de l’offre de logements,CNLES,https://www.cnle.gouv.fr/Sigles-de-l-Administration.html
CIE,Contrat initiative emploi,Sénat,https://www.senat.fr/histoire/sigles.html
CIEC,Commission internationale de l'état-civil,Sénat,https://www.senat.fr/histoire/sigles.html
CIEC,Centre d'Instruction Élémentaire de Conduite,Denis Merigoux,https://gist.github.com/ColinMaudry/fe30f024d3cea20d1f6ccd579d9acd3f#file-gendarmerie-csv
CIEDE,Centre d'information sur l'énergie durable et l'environnement.,M. Lafay - CCE-LR,http://www.cce-lrv.com/documents/images/general_photos/151_Fichier.pdf
CIELE,Centre d'information sur l'énergie et l'environnement,M. Lafay - CCE-LR,http://www.cce-lrv.com/documents/images/general_photos/151_Fichier.pdf
CIEM,Conseil international pour l'exploitation de la mer.,M. Lafay - CCE-LR,http://www.cce-lrv.com/documents/images/general_photos/151_Fichier.pdf
CIEP,Centre international d’études pédagogiques,DGAFP,https://www.fonction-publique.gouv.fr/files/files/statistiques/rapports_annuels/2016/G_Liste_des_sigles.pdf
CIEPE,Centre d'information environnement pour les entreprises,M. Lafay - CCE-LR,http://www.cce-lrv.com/documents/images/general_photos/151_Fichier.pdf
CIF,"Classification internationale du Fonctionnement, du handicap et de la santé",L. Bohu - maraudes.fr,http://maraudes.fr/glossaire-sigles-social-de-sante-de-ladministration/
CIF,Coefficient d'intégration fiscale,Sénat,https://www.senat.fr/histoire/sigles.html
CIF,Congé Individuel de Formation,Publidia,https://concours-fonction-publique.publidia.fr/guide-fonction-publique/infos-utiles/lexique-fonction-publique
CIFA,Contrat installation formation artisanale,L. Bohu - maraudes.fr,http://maraudes.fr/glossaire-sigles-social-de-sante-de-ladministration/
CIFIA,Comité interministériel de financement des industries agro-alimentaires,Sénat,https://www.senat.fr/histoire/sigles.html
CIFRE,Convention industrielle de formation par la recherche,Sénat,https://www.senat.fr/histoire/sigles.html
CIG,Centre interdépartemental de gestion,DGAFP,https://www.fonction-publique.gouv.fr/files/files/statistiques/rapports_annuels/2016/G_Liste_des_sigles.pdf
CIH,Classification Internationale Des Handicaps (voir aussi CIF qui a été adoptée depuis 2001),L. Bohu - maraudes.fr,http://maraudes.fr/glossaire-sigles-social-de-sante-de-ladministration/
CII,Comité interministériel à l’intégration,CNLES,https://www.cnle.gouv.fr/Sigles-de-l-Administration.html
CII,Compagnie internationale pour l'informatique,Sénat,https://www.senat.fr/histoire/sigles.html
CIIS,Centre d’information sur les innovations sociales,L. Bohu - maraudes.fr,http://maraudes.fr/glossaire-sigles-social-de-sante-de-ladministration/
CIJ,Cour internationale de justice,Sénat,https://www.senat.fr/histoire/sigles.html
CIJAP,Cellule d'Information Juridique aux Acheteurs Publics de Lyon,marche-public.fr,http://www.marche-public.fr/Marches-publics/Definitions/Marches-publics-Sigles.htm
CIL,Comité d’intérêt local,L. Bohu - maraudes.fr,http://maraudes.fr/glossaire-sigles-social-de-sante-de-ladministration/
CIL,Comités interprofessionnels du logement,Sénat,https://www.senat.fr/histoire/sigles.html
CILE,Centre international de liaison pour l'environnement.,M. Lafay - CCE-LR,http://www.cce-lrv.com/documents/images/general_photos/151_Fichier.pdf
CILE,Comité interministériel de lutte contre l’exclusion,CNLES,https://www.cnle.gouv.fr/Sigles-de-l-Administration.html
CILF,Conseil international de la Langue française,L. Bohu - maraudes.fr,http://maraudes.fr/glossaire-sigles-social-de-sante-de-ladministration/
CIM,Comité d’Information Médicale,L. Bohu - maraudes.fr,http://maraudes.fr/glossaire-sigles-social-de-sante-de-ladministration/
CIM-10,Classification internationale des maladies-10e révision,Keratocone,https://www.keratocone.net/acronymes.html
CIO,Centres d'information et d'orientation,beta.gouv.fr,https://github.com/betagouv/glossary-bot
CIO,Comité international olympique,Sénat,https://www.senat.fr/histoire/sigles.html
CIP,Club Inter Pharmaceutique,L. Bohu - maraudes.fr,http://maraudes.fr/glossaire-sigles-social-de-sante-de-ladministration/
CIP,Conseiller en insertion professionnelle,beta.gouv.fr,https://github.com/betagouv/glossary-bot
CIP,Commission Internationale Permanente ou Cellule Intervention Professionnelle,Denis Merigoux,https://gist.github.com/ColinMaudry/fe30f024d3cea20d1f6ccd579d9acd3f#file-gendarmerie-csv
CIPA,Cycle d’Insertion Professionnelle par Alternance,L. Bohu - maraudes.fr,http://maraudes.fr/glossaire-sigles-social-de-sante-de-ladministration/
CIPD,Comité Interministérielle de Prévention de la Délinquance,Denis Merigoux,https://gist.github.com/ColinMaudry/fe30f024d3cea20d1f6ccd579d9acd3f#file-gendarmerie-csv
CIPDR,Comité interministériel de prévention de la délinquance et de la radicalisation,CIPDR,https://www.cipdr.gouv.fr/
CIPE,Comité interministériel pour la promotion de l'emploi,Sénat,https://www.senat.fr/histoire/sigles.html
CIPPA,Cycle d’Insertion Professionnelle Par Alternance,L. Bohu - maraudes.fr,http://maraudes.fr/glossaire-sigles-social-de-sante-de-ladministration/
CIPR,Commission internationale pour la protection du Rhin,Sénat,https://www.senat.fr/histoire/sigles.html
CIPRNM,Comité interministériel de prévention des risques naturels majeurs.,M. Lafay - CCE-LR,http://www.cce-lrv.com/documents/images/general_photos/151_Fichier.pdf
CIR,Centre d'information routière.,M. Lafay - CCE-LR,http://www.cce-lrv.com/documents/images/general_photos/151_Fichier.pdf
CIR,Centre d’information sur la retraite,L. Bohu - maraudes.fr,http://maraudes.fr/glossaire-sigles-social-de-sante-de-ladministration/
CIR,Centre d'Information et de Recrutement,Denis Merigoux,https://gist.github.com/ColinMaudry/fe30f024d3cea20d1f6ccd579d9acd3f#file-gendarmerie-csv
CIRA,Centre interministériel de renseignements administratifs,Sénat,https://www.senat.fr/histoire/sigles.html
CIRAD,Centre de coopération internationale en recherche agronomique pour le développement,Sénat,https://www.senat.fr/histoire/sigles.html
CIRC,Centre d’incitation à la Recherche Clinique,L. Bohu - maraudes.fr,http://maraudes.fr/glossaire-sigles-social-de-sante-de-ladministration/
CIRCE,Centre interservices pour la recherche documentaire des communautés européennes.,M. Lafay - CCE-LR,http://www.cce-lrv.com/documents/images/general_photos/151_Fichier.pdf
CIRCIA,Caisse interprofessionnelle de retraite des cadres de l’industrie et assimilés,L. Bohu - maraudes.fr,http://maraudes.fr/glossaire-sigles-social-de-sante-de-ladministration/
CIRCOSC,Centre interrégional de coordination des opérations de sécurité civile,Sénat,https://www.senat.fr/histoire/sigles.html
CIRD,Comité interservices pour la recherche et le développement.,M. Lafay - CCE-LR,http://www.cce-lrv.com/documents/images/general_photos/151_Fichier.pdf
CIRDD,Centre d’Information et de Ressources sur les Drogues et les Dépendances,L. Bohu - maraudes.fr,http://maraudes.fr/glossaire-sigles-social-de-sante-de-ladministration/
CIRDI,Centre international pour le règlement des différends relatifs aux investissements,Sénat,https://www.senat.fr/histoire/sigles.html
CIRE,Cellules Inter Régionales D’épidémiologie (voir aussi INVS),L. Bohu - maraudes.fr,http://maraudes.fr/glossaire-sigles-social-de-sante-de-ladministration/
CIRED,Centre international de recherches sur l'environnement et le développement.,M. Lafay - CCE-LR,http://www.cce-lrv.com/documents/images/general_photos/151_Fichier.pdf
CIRI,Comité interministériel de restructuration industrielle,Sénat,https://www.senat.fr/histoire/sigles.html
CIRIT,Comité interprofessionnel de rénovation de l'industrie textile,Sénat,https://www.senat.fr/histoire/sigles.html
CIRJ,Cellule d'Information et de Rapprochements Judiciaires,Denis Merigoux,https://gist.github.com/ColinMaudry/fe30f024d3cea20d1f6ccd579d9acd3f#file-gendarmerie-csv
CIRRIC,Caisse Interprofessionnelle de Retraite par Répartition pour l’Industrie et leCommerce,L. Bohu - maraudes.fr,http://maraudes.fr/glossaire-sigles-social-de-sante-de-ladministration/
CIS,Cellule information solidarité,L. Bohu - maraudes.fr,http://maraudes.fr/glossaire-sigles-social-de-sante-de-ladministration/
CISIH,Centre d’information et de soins de l’immuno-déficience humaine,L. Bohu - maraudes.fr,http://maraudes.fr/glossaire-sigles-social-de-sante-de-ladministration/
CISP,Conseiller(ère) en insertion sociale et professionnelle,L. Bohu - maraudes.fr,http://maraudes.fr/glossaire-sigles-social-de-sante-de-ladministration/
CISS,Collectif Inter associatif sur la Santé,L. Bohu - maraudes.fr,http://maraudes.fr/glossaire-sigles-social-de-sante-de-ladministration/
CIT,Centre intégré de traitement ( des déchets ménagers ),M. Lafay - CCE-LR,http://www.cce-lrv.com/documents/images/general_photos/151_Fichier.pdf
CITES,Convention sur le commerce international des espèces de faunes et de flores sauvages ( convention de Washington),M. Lafay - CCE-LR,http://www.cce-lrv.com/documents/images/general_photos/151_Fichier.pdf
CITIFD," Cellule Immigration, Travail Illégal et Fraude Documentaire",Denis Merigoux,https://gist.github.com/ColinMaudry/fe30f024d3cea20d1f6ccd579d9acd3f#file-gendarmerie-csv
CITL,Centre D’initiation Au Travail Et Aux Loisirs,L. Bohu - maraudes.fr,http://maraudes.fr/glossaire-sigles-social-de-sante-de-ladministration/
CITP,Comité interministériel de la transformation publique,beta.gouv.fr,https://github.com/betagouv/glossary-bot
CITRAS,Centre inter-établissements de recherche clinique et de traitement anti-SIDA,L. Bohu - maraudes.fr,http://maraudes.fr/glossaire-sigles-social-de-sante-de-ladministration/
CITSS,Commissions Interrégionales de la Tarification Sanitaire et Sociale,L. Bohu - maraudes.fr,http://maraudes.fr/glossaire-sigles-social-de-sante-de-ladministration/
CIV,Comité interministériel des villes,Sénat,https://www.senat.fr/histoire/sigles.html
CIVI,Commission d’indemnisation des victimes d’infraction,Ministère de la Justice,http://www.justice.gouv.fr/art_pix/Stat_Annuaire_ministere-justice_sigles.pdf
CIVIS,Centre interprofessionnel pour l’information sur l’infection à VIH et le SIDA,L. Bohu - maraudes.fr,http://maraudes.fr/glossaire-sigles-social-de-sante-de-ladministration/
CIVIS,Contrat d'insertion dans la vie sociale,Sénat,https://www.senat.fr/histoire/sigles.html
CJCE,Cour de justice des Communautés européennes,Sénat,https://www.senat.fr/histoire/sigles.html
CJDES,"Centre Des Jeunes, Des Dirigeants,Des Acteurs De l’économie Sociale",L. Bohu - maraudes.fr,http://maraudes.fr/glossaire-sigles-social-de-sante-de-ladministration/
CL,Collectivité Locale,marche-public.fr,http://www.marche-public.fr/Marches-publics/Definitions/Marches-publics-Sigles.htm
CLACT,Contrats Locaux D’amélioration Des Conditions De Travail,L. Bohu - maraudes.fr,http://maraudes.fr/glossaire-sigles-social-de-sante-de-ladministration/
CLAD,Classe d’adaptation,L. Bohu - maraudes.fr,http://maraudes.fr/glossaire-sigles-social-de-sante-de-ladministration/
CLAIR,"Collèges Et Lycées Pour L’ambition, L’innovation Et La Réussite",L. Bohu - maraudes.fr,http://maraudes.fr/glossaire-sigles-social-de-sante-de-ladministration/
CLAN,Comité de liaison alimentation nutrition,DGOS,http://www.metiers-fonctionpubliquehospitaliere.sante.gouv.fr/Lexique-des-abreviations-ou-sigles.html
CLAP,Comité Local D’aide Au Projet,L. Bohu - maraudes.fr,http://maraudes.fr/glossaire-sigles-social-de-sante-de-ladministration/
CLAS,contrats locaux d’accompagnement scolaire,L. Bohu - maraudes.fr,http://maraudes.fr/glossaire-sigles-social-de-sante-de-ladministration/
CLAT,Centre de Lutte Anti-Tuberculeux,L. Bohu - maraudes.fr,http://maraudes.fr/glossaire-sigles-social-de-sante-de-ladministration/
CLAU,Commission locale d'aménagement et d'urbanisme.,M. Lafay - CCE-LR,http://www.cce-lrv.com/documents/images/general_photos/151_Fichier.pdf
CLCC,Centre de Lutte Contre le Cancer,DGOS,http://www.metiers-fonctionpubliquehospitaliere.sante.gouv.fr/Lexique-des-abreviations-ou-sigles.html
CLCV,"Consommation, logement et cadre de vie",Sénat,https://www.senat.fr/histoire/sigles.html
CLD,Chômeur de Longue Durée,L. Bohu - maraudes.fr,http://maraudes.fr/glossaire-sigles-social-de-sante-de-ladministration/
CLD,Congé longue durée,DGAFP,https://www.fonction-publique.gouv.fr/files/files/statistiques/rapports_annuels/2016/G_Liste_des_sigles.pdf
